{
  "build": {
    "builder": "PyInstaller 6.21.0 onedir",
    "npm_lock_sha256": "b51a16238da68741bff3c6f44bf7efc839cb53d2191546dc613dca48c5f52c6e",
    "python_lock_sha256": "c1fdaf45e6c10804ebe46fefbefd638b0e090463bf1a0ef1015bc7decbce3477",
    "source_revision": "b8b9766e6f5f1c2ba00a733735ed63c3eb8e2da6",
    "source_tree_sha256": "51feef70609e6f8627a9afd972939f5e55706b457dff39015710c5258f48a43a"
  },
  "candidate": {
    "application_version": "0.1.0",
    "architecture": "arm64",
    "id": "tunnelminion-0-1-0-darwin-arm64-51feef70609e-9a8a05a5d56d",
    "layout": "onedir-freeze",
    "platform": "darwin",
    "python_version": "3.12.11"
  },
  "entrypoint": "tunnelminion",
  "entrypoint_args": [],
  "files": [
    {
      "path": "THIRD_PARTY_LICENSES.json",
      "sha256": "293efe42da9598f68baa3aa493922ab3977dc2c5ba74137c2325f6f413dd36ce",
      "size": 45220,
      "type": "license-evidence"
    },
    {
      "path": "_internal/_cffi_backend.cpython-312-darwin.so",
      "sha256": "cedbb6edd5f68fee49335e7cdfa362dd2cb55d4dd8030b052770e8970838c6f8",
      "size": 246224,
      "type": "runtime"
    },
    {
      "path": "_internal/ada92cb5d92a588d1b93__mypyc.cpython-312-darwin.so",
      "sha256": "0a6a4e2e02ddf85054fafbbbeb7da0de08e6fb592650ab7490670483fd2be854",
      "size": 411392,
      "type": "runtime"
    },
    {
      "path": "_internal/attrs-26.1.0.dist-info/INSTALLER",
      "sha256": "e6184ce10e266134fdcfa401e8f1a95005bcd4f18d16b62b757323e2833fe9a9",
      "size": 2,
      "type": "runtime"
    },
    {
      "path": "_internal/attrs-26.1.0.dist-info/METADATA",
      "sha256": "4cd40e690f23bf37cbcad34efd6758e062df1df07c86833f7e3ce95bf1fa38cc",
      "size": 8754,
      "type": "runtime"
    },
    {
      "path": "_internal/attrs-26.1.0.dist-info/RECORD",
      "sha256": "6b0b326d4b4ee0fac27909ac7cbb066fc4bdf8e93d87031e27e770db059e5a04",
      "size": 2742,
      "type": "runtime"
    },
    {
      "path": "_internal/attrs-26.1.0.dist-info/REQUESTED",
      "sha256": "e3b0c44298fc1c149afbf4c8996fb92427ae41e4649b934ca495991b7852b855",
      "size": 0,
      "type": "runtime"
    },
    {
      "path": "_internal/attrs-26.1.0.dist-info/WHEEL",
      "sha256": "41c708c5adba6e097513ab8ccb9f1d7865a2fb469e22491a9e01dcc64da459fc",
      "size": 87,
      "type": "runtime"
    },
    {
      "path": "_internal/attrs-26.1.0.dist-info/licenses/LICENSE",
      "sha256": "882115c95dfc2af1eeb6714f8ec6d5cbcabf667caff8729f42420da63f714e9f",
      "size": 1109,
      "type": "runtime"
    },
    {
      "path": "_internal/base_library.zip",
      "sha256": "633cdb3e1ed3b7d306467e89c1a5a576e9eba145e53633c900fe2242ba8146a9",
      "size": 590236,
      "type": "runtime"
    },
    {
      "path": "_internal/certifi/cacert.pem",
      "sha256": "bbc7e9c01d7551bb8a159b5dedd989b8ee3ce105aff522b68eb1b01bf854cab0",
      "size": 234354,
      "type": "runtime"
    },
    {
      "path": "_internal/certifi/py.typed",
      "sha256": "e3b0c44298fc1c149afbf4c8996fb92427ae41e4649b934ca495991b7852b855",
      "size": 0,
      "type": "runtime"
    },
    {
      "path": "_internal/charset_normalizer/cd.cpython-312-darwin.so",
      "sha256": "de0aba70a66aceb4c6552717421276fd4230dbdf1ee1cf6bf9c2091fc407ae22",
      "size": 68192,
      "type": "runtime"
    },
    {
      "path": "_internal/charset_normalizer/md.cpython-312-darwin.so",
      "sha256": "274d8d84e9cf695590988aef51abf4a8a7059e01341ec2edf9a74a10847e0e78",
      "size": 68192,
      "type": "runtime"
    },
    {
      "path": "_internal/click-8.4.2.dist-info/INSTALLER",
      "sha256": "e6184ce10e266134fdcfa401e8f1a95005bcd4f18d16b62b757323e2833fe9a9",
      "size": 2,
      "type": "runtime"
    },
    {
      "path": "_internal/click-8.4.2.dist-info/METADATA",
      "sha256": "194c9dd81d567f9081f026c7e401060fbafa7bc147c8e0a58b3668b40a64c031",
      "size": 2621,
      "type": "runtime"
    },
    {
      "path": "_internal/click-8.4.2.dist-info/RECORD",
      "sha256": "f14e3990f101ef4a1dd09903eb3f859f233ec1d9bd9a00e4470f207568804d12",
      "size": 1810,
      "type": "runtime"
    },
    {
      "path": "_internal/click-8.4.2.dist-info/REQUESTED",
      "sha256": "e3b0c44298fc1c149afbf4c8996fb92427ae41e4649b934ca495991b7852b855",
      "size": 0,
      "type": "runtime"
    },
    {
      "path": "_internal/click-8.4.2.dist-info/WHEEL",
      "sha256": "1b68144734c4b66791f27add5d425f3620775585718a03d0f9b110ba3a4d88db",
      "size": 82,
      "type": "runtime"
    },
    {
      "path": "_internal/click-8.4.2.dist-info/licenses/LICENSE.txt",
      "sha256": "9a8ad106a394e853bfe21f42f4e72d592819a22805d991b5f3275029292b658d",
      "size": 1475,
      "type": "runtime"
    },
    {
      "path": "_internal/cryptography-50.0.0.dist-info/INSTALLER",
      "sha256": "e6184ce10e266134fdcfa401e8f1a95005bcd4f18d16b62b757323e2833fe9a9",
      "size": 2,
      "type": "runtime"
    },
    {
      "path": "_internal/cryptography-50.0.0.dist-info/METADATA",
      "sha256": "d4e345f82cb783877d73261f00303577cdf20d13229176c2d03a0a5603cb3ab5",
      "size": 4343,
      "type": "runtime"
    },
    {
      "path": "_internal/cryptography-50.0.0.dist-info/RECORD",
      "sha256": "7069e8c16992bc37bdf65538233cc6c720d9071bda22afcd26ef704b097b688d",
      "size": 12278,
      "type": "runtime"
    },
    {
      "path": "_internal/cryptography-50.0.0.dist-info/REQUESTED",
      "sha256": "e3b0c44298fc1c149afbf4c8996fb92427ae41e4649b934ca495991b7852b855",
      "size": 0,
      "type": "runtime"
    },
    {
      "path": "_internal/cryptography-50.0.0.dist-info/WHEEL",
      "sha256": "96f985b465650f71b86992fc892c82e72b15557fbb9855563b0c8a6b1fa6d712",
      "size": 104,
      "type": "runtime"
    },
    {
      "path": "_internal/cryptography-50.0.0.dist-info/licenses/LICENSE",
      "sha256": "3e0c7c091a948b82533ba98fd7cbb40432d6f1a9acbf85f5922d2f99a93ae6bb",
      "size": 197,
      "type": "runtime"
    },
    {
      "path": "_internal/cryptography-50.0.0.dist-info/licenses/LICENSE.APACHE",
      "sha256": "aac73b3148f6d1d7111dbca32099f68d26c644c6813ae1e4f05f6579aa2663fe",
      "size": 11360,
      "type": "runtime"
    },
    {
      "path": "_internal/cryptography-50.0.0.dist-info/licenses/LICENSE.BSD",
      "sha256": "602c4c7482de6479dd2e9793cda275e5e63d773dacd1eca689232ab7008fb4fb",
      "size": 1532,
      "type": "runtime"
    },
    {
      "path": "_internal/cryptography-50.0.0.dist-info/sboms/cryptography-rust.cyclonedx.json",
      "sha256": "54081fdbdef1be6a999e97892f4511ee90c6919837c3c69ae17dcca918a4cdff",
      "size": 45993,
      "type": "runtime"
    },
    {
      "path": "_internal/cryptography-50.0.0.dist-info/sboms/sbom.json",
      "sha256": "32a6df133510099efa1dbb350e4870bcd6ea0d83f99277c70fc81c19fe45d0b8",
      "size": 1205,
      "type": "runtime"
    },
    {
      "path": "_internal/cryptography/hazmat/bindings/_rust.abi3.so",
      "sha256": "9e9c6f824ea4fe0c653ff536a0b560aa5c5e75ea3cd18650d0a11c4c1dab9b01",
      "size": 11741984,
      "type": "runtime"
    },
    {
      "path": "_internal/jiter/jiter.cpython-312-darwin.so",
      "sha256": "6af0ee3be778425153bedf828c426296861b7d865e244d0b1eadd7059eadb410",
      "size": 743920,
      "type": "runtime"
    },
    {
      "path": "_internal/jsonschema-4.26.0.dist-info/INSTALLER",
      "sha256": "e6184ce10e266134fdcfa401e8f1a95005bcd4f18d16b62b757323e2833fe9a9",
      "size": 2,
      "type": "runtime"
    },
    {
      "path": "_internal/jsonschema-4.26.0.dist-info/METADATA",
      "sha256": "05b189866ca98a96da3934bf6b83687ced3ff85325273b77e16b705f6d8b26d2",
      "size": 7592,
      "type": "runtime"
    },
    {
      "path": "_internal/jsonschema-4.26.0.dist-info/RECORD",
      "sha256": "c69a7421016745a26424b247b730ac40ff82b5e42741dfb8afa563b2e3029466",
      "size": 4079,
      "type": "runtime"
    },
    {
      "path": "_internal/jsonschema-4.26.0.dist-info/REQUESTED",
      "sha256": "e3b0c44298fc1c149afbf4c8996fb92427ae41e4649b934ca495991b7852b855",
      "size": 0,
      "type": "runtime"
    },
    {
      "path": "_internal/jsonschema-4.26.0.dist-info/WHEEL",
      "sha256": "58b82a17209f9bf2804afe161f2632d0fde933f9bb2792fd936b2474a2e2ac2f",
      "size": 87,
      "type": "runtime"
    },
    {
      "path": "_internal/jsonschema-4.26.0.dist-info/entry_points.txt",
      "sha256": "bceeeb5f816cff1215272da99c0b4a8134b17e99e8cc0550d038c29a93319d61",
      "size": 51,
      "type": "runtime"
    },
    {
      "path": "_internal/jsonschema-4.26.0.dist-info/licenses/COPYING",
      "sha256": "4f92a015a13c4d1a040bef018aa13430b4f1bc73b41b16bb846c346766de7439",
      "size": 1057,
      "type": "runtime"
    },
    {
      "path": "_internal/jsonschema/benchmarks/issue232/issue.json",
      "sha256": "79a3ce663311bb9bbc4692abb00f6e93bb9c3d94b9b64286e03fe190e4d0dc79",
      "size": 117105,
      "type": "runtime"
    },
    {
      "path": "_internal/jsonschema_specifications/schemas/draft201909/metaschema.json",
      "sha256": "7b761b3e121f0a0ca1ea2a0b8e2cc856bcf801604b8268d71bacaa202bc0c13b",
      "size": 1785,
      "type": "runtime"
    },
    {
      "path": "_internal/jsonschema_specifications/schemas/draft201909/vocabularies/applicator",
      "sha256": "6895100e99726fbb107058512bbec3ecfd4b24e8fd2facee3e505ee72b0d4c31",
      "size": 1860,
      "type": "runtime"
    },
    {
      "path": "_internal/jsonschema_specifications/schemas/draft201909/vocabularies/content",
      "sha256": "9b7d4f55a4e2fdb02c430068fdffabc732addce238da3f1df2690249c3353274",
      "size": 517,
      "type": "runtime"
    },
    {
      "path": "_internal/jsonschema_specifications/schemas/draft201909/vocabularies/core",
      "sha256": "b5a2c4957f6495d0a5081f0409ebe8a14e4139acb203fc748471f8ede2af5b2c",
      "size": 1531,
      "type": "runtime"
    },
    {
      "path": "_internal/jsonschema_specifications/schemas/draft201909/vocabularies/format",